{
  "$schema": "http://json-schema.org/draft-07/schema#",
  "type": "object",
  "properties": {
    "id": {
      "description": "a snake-case-style slug that will also be used in URLs (and, therefore, needs SEO considerations)",
      "maxLength": 35,
      "type": "string"
    },
    "label": {
      "description": "A few capitalized words (often just a capitalized version of the slug) that the user will see for the challenge.",
      "maxLength": 60,
      "type": "string"
    },
    "description": {
      "description": "Try to keep it to one shortish sentence.",
      "maxLength": 100,
      "type": "string"
    },
    "difficulty": {
      "description": "The difficulty level for this challenge.",
      "type": "string",
      "enum": ["beginner", "easy", "medium", "hard", "extreme", "event"]
    },
    "language": {
      "description": "The programming language for this challenge.",
      "type": "string",
      "enum": [
        "TYPESCRIPT",
        "JAVASCRIPT",
        "PYTHON",
        "GO",
        "JAVA",
        "RUST",
        "CSHARP",
        "PHP",
        "RUBY",
        "KOTLIN",
        "CPP",
        "C",
        "SWIFT",
        "SCALA",
        "ELIXIR",
        "CLOJURE",
        "HASKELL",
        "PERL",
        "LUA",
        "SQL",
        "typescript",
        "javascript",
        "python",
        "go",
        "sql"
      ]
    },
    "practiceType": {
      "description": "The product-facing practice type. Code tasks use a programming language; SQL tasks use a separate query workflow.",
      "type": "string",
      "enum": ["code", "sql"]
    },
    "supportedLanguages": {
      "description": "Languages exposed by this task type. Code tasks can list multiple programming languages; SQL tasks should list sql.",
      "type": "array",
      "items": {
        "type": "string",
        "enum": ["python", "typescript", "javascript", "cpp", "java", "go", "rust", "sql"]
      },
      "minItems": 1,
      "uniqueItems": true
    },
    "prerequisites": {
      "description": "An array of ids of other challenges that this challenge is written as to expect the reader to already understand.",
      "type": "array",
      "items": {
        "type": "string"
      }
    },
    "author": {
      "description": "The author of this challenge",
      "type": "string"
    }
  },
  "required": [
    "id",
    "label",
    "description",
    "difficulty",
    "author",
    "language",
    "practiceType",
    "supportedLanguages"
  ]
}
