{
  "id": "python-fish-min-catch",
  "label": "Самая маленькая рыба",
  "description": "Найди самое маленькое число в списке.",
  "difficulty": "beginner",
  "language": "python",
  "author": "ЛитКот",
  "practiceType": "code",
  "supportedLanguages": [
    "python",
    "typescript",
    "javascript",
    "cpp",
    "java",
    "go",
    "rust"
  ]
}
