{
  "id": "python-fish-sum-catch",
  "label": "Сумма улова",
  "description": "Сложи все числа в списке и верни сумму.",
  "difficulty": "beginner",
  "language": "python",
  "author": "ЛитКот",
  "practiceType": "code",
  "supportedLanguages": [
    "python",
    "typescript",
    "javascript",
    "cpp",
    "java",
    "go",
    "rust"
  ]
}
