{
  "id": "python-fish-even-catch",
  "label": "Четный улов",
  "description": "Посчитай, сколько чисел в списке четные.",
  "difficulty": "beginner",
  "language": "python",
  "author": "ЛитКот",
  "practiceType": "code",
  "supportedLanguages": [
    "python",
    "typescript",
    "javascript",
    "cpp",
    "java",
    "go",
    "rust"
  ]
}
