{
  "id": "python-fish-islands",
  "label": "Острова на карте",
  "description": "Посчитай группы единиц в сетке.",
  "difficulty": "medium",
  "language": "python",
  "author": "ЛитКот",
  "practiceType": "code",
  "supportedLanguages": [
    "python",
    "typescript",
    "javascript",
    "cpp",
    "java",
    "go",
    "rust"
  ]
}
