{
  "id": "python-fish-rotate-bowls",
  "label": "Поворот мисок",
  "description": "Поверни список мисок вправо на k шагов.",
  "difficulty": "easy",
  "language": "python",
  "author": "ЛитКот",
  "practiceType": "code",
  "supportedLanguages": [
    "python",
    "typescript",
    "javascript",
    "cpp",
    "java",
    "go",
    "rust"
  ]
}
