{
  "id": "python-fish-positive-catch",
  "label": "Положительный улов",
  "description": "Проверь, является ли число положительным.",
  "difficulty": "beginner",
  "language": "python",
  "author": "ЛитКот",
  "practiceType": "code",
  "supportedLanguages": [
    "python",
    "typescript",
    "javascript",
    "cpp",
    "java",
    "go",
    "rust"
  ]
}
