{
  "id": "python-fish-dijkstra",
  "label": "Золотая рыбка (Dijkstra)",
  "description": "Найди самый дешевый (по силам) путь к золотой рыбке через опасные дворы.",
  "difficulty": "extreme",
  "language": "python",
  "author": "ЛитКот",
  "practiceType": "code",
  "supportedLanguages": [
    "python",
    "typescript",
    "javascript",
    "cpp",
    "java",
    "go",
    "rust"
  ]
}
