{
  "id": "python-fish-stack",
  "label": "Скобочный Тыгыдык (Stack)",
  "description": "Проверь, правильно ли расставлены миски и крышки в шкафу.",
  "difficulty": "easy",
  "language": "python",
  "author": "ЛитКот",
  "practiceType": "code",
  "supportedLanguages": [
    "python",
    "typescript",
    "javascript",
    "cpp",
    "java",
    "go",
    "rust"
  ]
}
