{
  "id": "python-fish-cat-repeat",
  "label": "Кот-эхо",
  "description": "Повтори строку указанное количество раз.",
  "difficulty": "beginner",
  "language": "python",
  "author": "ЛитКот",
  "practiceType": "code",
  "supportedLanguages": [
    "python",
    "typescript",
    "javascript",
    "cpp",
    "java",
    "go",
    "rust"
  ]
}
