{
  "id": "python-fish-prefix-patrol",
  "label": "Патруль префиксов",
  "description": "Посчитай отрезки пути, где кот вернулся к старту.",
  "difficulty": "medium",
  "language": "python",
  "author": "ЛитКот",
  "practiceType": "code",
  "supportedLanguages": [
    "python",
    "typescript",
    "javascript",
    "cpp",
    "java",
    "go",
    "rust"
  ]
}
