{
  "id": "python-fish-yarn",
  "label": "Распутывание Клубка (Reverse Linked List)",
  "description": "Разверни связный список, как если бы ты разматывал клубок ниток.",
  "difficulty": "medium",
  "language": "python",
  "author": "ЛитКот",
  "practiceType": "code",
  "supportedLanguages": [
    "python",
    "typescript",
    "javascript",
    "cpp",
    "java",
    "go",
    "rust"
  ]
}
